{
  "schema": "nf-meta-runtime-manifest/1",
  "version": "1.0",
  "machine_digest": "e2efe89661c386cd7b282992cdf833776d0840925f27152b44dbac5a1b0219c9",
  "runtime_digest": "e2efe89661c386cd7b282992cdf833776d0840925f27152b44dbac5a1b0219c9",
  "task_profile_digest": "0ddb101eb028a0f631a40d8efbc687cd3951528f6fc3f95ff4c4fbd98ed989c1",
  "atom_contracts_digest": "f6a79934733595db4ac7dcec4db6f17ebd9f39f8d557eca5f8aea79aca8428e1",
  "file_digests": {
    "ATOM_MENU.md": "d02816fa60b25da4b5f92d0b34d4ffaf1a13b35144903ab82d7b00dd3d2bff24",
    "COCKPIT_PROTOCOL.md": "7f60c1b72fb511840e20466abf863a5cb2d4ee8c1e509a5cf8fcb75b61edf1f8",
    "COCKPIT_RELEASE_NOTES.md": "f8499f8dd5cc02671db6ea0b583d159e389eb11eb8f82ff5623f9f6bf93e86f3",
    "DIFFERENTIATION.md": "5d9b90cd34f340d36aaa0b0438ded87717bfe135af53d77180369520fca3a882",
    "__init__.py": "9d9101a1640b6e01684db522db14e87c870819e8136cf95c1abf69323dbe5358",
    "abstention.py": "21e0c8a24bb86806364494c64a6261ed9d07f1c7a4bc06d669a85326a60a64e7",
    "atom_algebra.py": "57adf9bd9a69d930f674dc606ce013769c202c7387a065c471bfa3ac8b4a9e4f",
    "atom_contracts.json": "f6a79934733595db4ac7dcec4db6f17ebd9f39f8d557eca5f8aea79aca8428e1",
    "atom_planner.py": "48273adc948da70920cfe399947359c433e63dbbd5eaa28bb1d29a7c7ad38848",
    "atomic_io.py": "50d9cbc71e4233cf79414fa87a00272b28dc70e8a4440460110ecec3175ed10c",
    "build_atom_menu.py": "5ae9da4c963f685e7ce918c2606ff3e1c171a0b97b697622d2e7123567d8e56e",
    "calibration_ledger.py": "757bf3665acec8d9a246c1dff5a38b50ee2e8860762ccb1bc1ba5d2792155cae",
    "calibration_store.py": "e77130d3e410a9dbe249890b59387df993d67b7646c75752074dd5796dfd7306",
    "chain_horizontal.py": "5baf3f5b50da7765849cd8787854c3ca5985f17c087f5d245831aa549c69a481",
    "chain_knowledge.py": "cde63a15729ab361dc72cbdb4ccce8c1083dcb0950a375105c8cd317728d9d53",
    "chain_vertical.py": "956384d03c82520685b691627d31a464ef097527d15b2506bc21b4892a208858",
    "cockpit_ab.py": "ae7a62ad3d3040c750a4b8a07794ae350bc5660e7f19679cb9330646cf32d04f",
    "cockpit_ab.schema.json": "61d5bb6b0ee7a69ecf117d1f35c828cb2c902e08856bbb63aabb652cdda49437",
    "cockpit_ab_ballots.schema.json": "04f4861010f3766f1507c4e4c0a1db612de3621543ef64ae3ee5b81566a777ab",
    "cockpit_ab_bundle.py": "d774a8e0901ee7eb4f82b47ea5ba470e2d8e1da908fcaa82cb1ce62bec13e9ed",
    "cockpit_ab_bundle.schema.json": "cb86572c987c3036b73f60cbf344fdad6e787d933df6ab7b924d75195d6f3af8",
    "cockpit_ab_result.schema.json": "d9632711d499a462854eeee47fb5dfa44420645bf507fbfa2a0e98f8f6c62cf6",
    "cockpit_ab_store.py": "6ef0352ea5246c9b70502fb8e3bd6397afc5f250b977867e2b0703b18a08b205",
    "cockpit_handoff.py": "0a9f66e3f2d8c37bf80ba9941502dd869e610b845eb408a2fde8ae4132fcd03f",
    "cockpit_handoff.schema.json": "b296ed11d0db164180d112325144057119aec045c943b1e3f602abe11c121b43",
    "cockpit_journal.schema.json": "9373b8f5642eaa6ef880d9d0dcec0760086b685cc922fccdc0886cc7e9b79f0d",
    "cockpit_manifest.schema.json": "f495fb97a71023997b7b09c561404befd4d39a6439b0d13d5bf99a2460ed8966",
    "cockpit_service.py": "18280c6966dd618a8b09daa058b461fa43f89e99f11c797ca884338ff5c13bbf",
    "cognition_meta_pipeline.json": "fb364f183cfae672e09431d79741165bf7e7fe4aac200f0ae1864bf9216fc1e8",
    "cognition_method.schema.json": "cf9c129a1f26bb38a8cd44953e96e71af741b0450035a96e8facbb3b20dd164d",
    "cognition_pipeline.json": "0cc1482807e9da79b6ff45decf97edfa03aa44bc1f7752b1cf17b98758eb6093",
    "cognition_pipeline.schema.json": "ea9b2728281fb2279ce9af4a77cfede699defd3464877c9ed90071306c5a2341",
    "cognitive_cockpit.py": "a3f43c43ebe50516a46ad80531605a10682ad548d39b2aafc6a4aa8212f44412",
    "coherence.py": "687a7ceea503eab1e32d11f12d0cca45b4944d130213e67a32862f35dfbd7123",
    "comparison_fixture.py": "51322b9d3e6f679a80589b9811e337aa11432f75964e96561ed9b205551c2a09",
    "constrained_candidates.schema.json": "d3ad153d8ce60e221b214317824b7bf58d0c4c73db6f9e085be39e34529576ef",
    "constrained_choice.py": "9c7f2d9d883bfeeacb596576ef497e07ede0080b898ca05e9bed3e155ce7dbc2",
    "constrained_choice.schema.json": "839c14654ece10639f833ad3246eea670893c535c432986262da995e0f82be34",
    "constrained_loop.py": "42a48fa5aa296bf20f72b38fa45142089383bbe0becdfb4a2c40eca5c1b78fc9",
    "context_pack.py": "435e5f4dd0e78277edd68fd1a259d399cabfa8e786c78b61300384649084b34f",
    "criteria_lexicon.py": "0c78d758d5350ff497b3a4bfa3f8786d081bdebfc2fb4eefd534548f7763fd96",
    "criterion_policy.json": "b81274c3b3b5f8b16f9e1602c2ce7ff5770a4ce9219cccf6815ef7e99e8d275b",
    "domain_sources.py": "d46e4b82952015b990205d213879bf52a98468751850367cac639ec95b4f0205",
    "epistemic_agenda.py": "e705b349dc12de6b8224eeecedb7bafaf77f0c898099c35ab449eed51470fdd0",
    "evidence_roles.py": "9afd164926bb141aab57c7477fe616be3e77951fbeb859deee9710b60e21b68c",
    "file_lock.py": "9b964f1f4d2e7e05aab7a06aaff176fd91be5057e700ff5d52e9b5cbca67c13c",
    "file_model_adapter.py": "4fc3ad0bdc18bed7a90ad230948b31363e94e590e7cb285ddc2a9579364a76a9",
    "human_review.schema.json": "f8265ae64a15fdf7c64506f419068e5e4d3f13739f8a9c06abefccb6fc549640",
    "human_review_gate.json": "920c44194978b46910aaa7d6eb2b79ee091eeab013b1a1841edf54f8f7e29dfd",
    "json_asset.py": "0abf1068f4c0b1017f77d426fa5d51a37b9d75029c7298941cca071c0fed5465",
    "live_cockpit.schema.json": "f35a44868c08281a6fc19e2c5ac6bc51e9a8c149f683fa480f6e1c9c041a42f2",
    "live_protocol.py": "981bd7711798ec9b233af2fa5a57ea5f97716036ed6b95d4630ba6a911e2ecfb",
    "live_selector.py": "fefe87925aa65a215305466e1f857c64eed74e46fc4347aff77060860ce30fb4",
    "mcp_context.py": "b010c3a70b150f2bd07fd5db4da22c019a8eaab6950923bbc345c621f9b4df9e",
    "mcp_context_response.schema.json": "456e1bd8c333ad06946b809d71e6967e9818e87c634316a8b7ce819b63685a61",
    "meta_atom_runtime.py": "76c69d0410a0e27f568335b8c6cb0dd38a0a3523b76f9e722a43caef286a4bcb",
    "meta_atoms.json": "20c4210dfeda81795e791ab00805786b562a597cc1c2872405d755275c96e653",
    "meta_gradient.json": "bfb50d95c02491ba31f23a178d322c71715a55e7e62d5e4a438cfa86a40e6ca7",
    "meta_guard.json": "fa36bb06b55eafede6d566440f275ba7f55ebebde16d4e8837058f2134e7db7e",
    "meta_runtime_manifest.py": "ef1b3640a78e6ae9e67029e80806984427713d90027e2e7fe93f3dd643c923e7",
    "meta_runtime_manifest.schema.json": "2866cb01838b509cb73d3e482237f2e832c1fdab6841084d177cddf3b4b1cab9",
    "metacognitive_control.py": "2e0fa2f83abcbfc8cab279899eebf82440b76ee02c3228ea988a9dd25a4236a7",
    "method_abstract.json": "b40e809645e446ecae4593423ed797a0f6c73e61906feef18a7cc993dc12dca2",
    "method_causal.json": "1c0f2181c48fd74bc98dd3fe7002e8a1e968f6fd2e96a092bfa27a3c918932fc",
    "method_cluster.json": "e55aced8bdcccceb3c8609db18b0e9b8562b65ae227d72052d5683a5b7d955e4",
    "method_counterexample.json": "72621ce72b5bcd0093e0d5edfc717b038810600c7ac2cc282b029b6d99f09dd6",
    "method_decompose.json": "021d4ab0e368930cea071314607462d1595ea0905c1551be944e8a130d72da85",
    "method_evidence_standard.json": "c81015803efa82f1816c0ef6d8ac725f136c03941ed4bfd1b705966f4bf69ade",
    "method_frame.json": "08bf1ab5fe7cb064969337057edc5656bb6f4fe833a687ce0f480b90e9edc32d",
    "method_frame_audit.json": "91b5d8029021ab1834433b4c45b4c2c225ab01b7ba8c82149fec0cda1c133235",
    "method_matrix.json": "e0aa14aa0c7802c74950a6b4ad2b021eee808ea6f66c933b336c7025028c6dda",
    "method_memory.py": "30549a5b13adb610774dd2bbf655de497e8a05054fd14d62601389cd76e88bff",
    "method_method_audit.json": "0a91a21081dd504c2528d7329cfeb7e0c90b6d8f31048f5c93b4f0df1c1b2396",
    "method_process_monitor.json": "d6d0fe624c32d033fc8ce806248526c952327f63011804271f775f90f2508884",
    "method_router.json": "b3d034e04969cfe3c2ce307acb8e07ab218c28622069406b7422e9af34c0234e",
    "method_synthesis.json": "2ed08257840322883185215ee6986ae0386aa25b90a918437e2119d343b6cbcf",
    "method_system.json": "9ff05563c8f93c2b9684629eed661bd07e4a782ab2dc2e074679ab41255047cf",
    "nf_ab_cli.py": "21bd6933554c0858241e51d8ddb4f985062d52929cdfa8085b176c329ddfcd66",
    "nf_cockpit_cli.py": "a963c529ecc96a40b5657e6d89ed5e3fdacb287f9ab14bba6def1bf705dbc625",
    "nf_metacognition.py": "356169034137b78ec2672d82448bc9b1ab25764bd99acc2c6ceebfb4e7d1b152",
    "nf_source_registry.json": "597f9dcf6eb5e4a224671c7af75f15ab5a740f98df30905b6c16416bb6407c3f",
    "plan_compiler.py": "a43cec2b89718523eec95d90594d7c83004d594b203db2d129f50aa2f684d7a6",
    "repo_context.py": "04578eb5a6799b89d0744aa8ad4abb7f5ed7888f8a7b1569278fe664147f3493",
    "runtime_executor.py": "204a67ec93855257323887011395b0866ac8d5ae1c485362e89eb058ffe64bfb",
    "schema_compat.py": "abea7df4830c87220352701a8eeaf4c9a030f00d7b16b2ce41eb08ddf35ed97e",
    "secret_guard.py": "bd4975d54246ffda6d834a7f40a189501b996002cae2bf1d0a0dc5595167b69b",
    "self_application.json": "070bfc2c5a42a5bc7aa31c2d084207ccddee37b9a7d2dc5f021e79635c1b4b81",
    "session_journal.py": "b57a061d71de6f6a7e675eea97d788f5ca31cd43840b3b79dd1a319504a7c73d",
    "source_excerpts.py": "1f06a9cd03ca322539e55406b5c4221de2bbd14c2bbb4b40a7bb5f0feadff68a",
    "task_handoff.py": "731567d9a104153932c3559f7b08e3da7d13ee692a05a997af0f8bea156bb023",
    "task_profile.py": "0091ce00c186e593f90041c0e1079e81f5c2137f569e4d3a986ff6cd1f03beef",
    "task_profile_probes.json": "e559923056cec57331894f0a92b13f89613474780feb6022cb9ebbda9a67ea9c",
    "task_profiles.json": "0ddb101eb028a0f631a40d8efbc687cd3951528f6fc3f95ff4c4fbd98ed989c1",
    "task_profiles.schema.json": "55ad54489a269f877513cfa22f63d41a37cdcbd4a3d893a2f46422bd688fcd35",
    "thought_contract.py": "b35acc8cc4f8363fd759d31129b0ae4cbf2aaea0460c60ce6127df5fce1c6f83",
    "value_kind_policy.json": "b5fd118d42235a61fd4994fafe19bc7c7fad71fccf97751a91502f85fe943cd1"
  },
  "limits": {
    "context_units": 8000,
    "references_partition": 1000,
    "method_history": 8,
    "search_expansions": 2000,
    "search_generated": 10000,
    "calibration_store_bytes": 1048576,
    "journal_bytes": 8388608
  },
  "capabilities": {
    "offline": true,
    "deterministic_replay": true,